userName,at,content,score,thumbsUpCount
Phoebe Cameron,2026-01-27T13:48:52,"update--recent updates have eliminated custom goals on the free version. and now I see the restaurant food search section has disappeared. keep taking things away. logging getting quirky. not improving. Overall good. Been using a long time now. Since the last update logging food has been buggy. When I try to add previous meals it will only add one or two items. Hopefully will fix in another update. Meets all my needs in tracking food, water, workouts and nutrition breakdown.",3,2
Robin Gorenberg,2026-02-02T03:43:52,I love this app and have been using it decades. The last update moved the done logging check mark to the middle of the page underneath all the meals but before exercise and water and other goals. It used to be at the bottom of the screen so you could always find it easily just by scrolling all the way to the bottom. I never understand why apps make changes like this that actually make it less user friendly and absolutely no reason to move it from the bottom. Hope you change it back.,3,5
Becca Shaffner,2026-01-24T23:28:16,"I love a lot of things about this app: the ability to scan barcodes, create recipes, repeat meals (especially handy when I enjoy leftovers) are really helpful. Beware of inaccurate food profiles. This app collects entries from a myriad of resources and accuracy varies widely. If you're careful, you're good.",3,1
War Eagle !,2025-12-03T12:35:05,"It's an OK app. Lots of good stuff in it, but I feel like it's missing stuff too. I may be missing it somewhere, but for example, for being a paid app, you'd think they'd have a built in step counter, especially since its so focused on calorie intake and exercise. Seems like something that could easily be built in. This would would make it easier on the user to better track some activity.",3,2
Jazmine N. Gulezian,2025-11-12T22:27:20,"I love and hate this app. The longer I use it, the slower it seems to get. It can take 30 seconds to load between actions sometimes and it's so frustrating because it happens multiple times a day. It was not at all like this when I first started using it in August. It can be buggy with logging food on the wrong day as well. Sometimes if I log food on a future day, it will add it to today's log instead. I'm paying for it for crying out loud, please make it run smoother!",3,6
Anne DeGreve,2025-12-18T21:57:24,"I've used this app for years. I used to love it, but the latest version has made it virtually unusable. Quickly adding planned foods is now buggy with it clicking into the food details instead of adding it. The macros are per meal; no longer can you just scroll through each food to see macros. It's hard to find other micronutrient data now. It's slow and clunky. What happened??? I wrote to the company and they said it's fixed. What's fixed?",3,9
David Battoe,2025-11-09T19:45:43,"Mostly does what it's meant to, but it resets my calorie limit every week which is annoying. I have to manually change it back to the right one. Also i don't understand why i have to manually click ""done logging"" also, if I remember correctly, you used to be able to pay for a year's worth of premium at a time which netted you a discount and I don't think you can anymore. or at least I can't figure out how",3,3
Rick Garlick,2025-12-24T18:21:20,"With the update, you can no longer click an arrow at the top to see yesterday's results. Now you have to go to the dashboard, click on macronutrients, then hit daily at the top, then go back to the log. What a pain in the rear. Instead you have a calendar which shows where you stand pertaining to your calorie goal, which is what the dashboard is for. Put the arrow back, please!",3,5
A Google user,2025-12-23T15:23:23,"Life-changing app thus far. For years, I did fine with exercise, but struggled with portion control & calorie counting. Now, I find it to be easy. So far I have lost 15 lbs in 3 months. Edit: I revise my review downwards, as food item search results are clogged with unhelpful items that arent verified, or calories are listed ""per serving."" This is BS. There are a limited number of meats, and they are either boiled, roasted, fried, etc. Calories should be known by gram and ounce, period.",3,1
brenna hill,2025-11-19T15:01:38,"What would make this app perfect is if I could change my calorie intake day by day and plan out my reverse dieting in app. Adding in 10 to 20 calories a day keeps me from gaining weight when I want to be eating more. edit 11/19/25 the app had gotten incredibly laggy. I've been using it for years and want to continue to use it, but with every update things get harder to use and slower. now I have adds to contend with in the middle of an entry.",3,1
Jean Fig,2025-11-14T03:49:49,I like this app and I've had it for a long time. I'm not a fan of the recent update though. Used to be able to see the individual nutrients in every item of food you consumed in a meal just by scrolling back and forth at the top your home feed. The update made the app worse and harder to navigate and keep track of everything. I try to get as much fiber and protein in my day as possible and being able to see what food items individually have that was a huge help. Fix please!,3,12
Janet Gonnella,2025-11-23T01:47:16,"Not liking the new updates. Lose It has always been far superior to other similar apps, but I find the new interface on the tracking log clunky and way too busy. I am more interested in the calories I have consumed vs. calories I have left in my budget, and having to manually scroll up to see this information is frustrating. It would be one thing if you could personalize the layout to display what you find important, but are forced to view what the developers think is important.",3,6
Chris Streeper,2025-12-28T05:04:58,"I HATE THE NEW UPDATE!!! I've been using this app for nearly a decade and have been very satisfied. A few months ago everything changed... Food choices are limited. Navigation is harder. Viewing is crowded. I've purchased the Lifetime subscription, and now I'm considering dumping it entirely and using something else. This app went from being absolutely fantastic, to mediocre at best. And they want me to pay a ""Lifetime membership"" again.",3,7
Karsyn,2025-11-26T02:20:49,"Switched to this app over MFP awhile ago and overall have loved it in comparison. However, the most recent update has made the macro tracking on the app much more inconvenient than it used to be. I used to be able to see all my macro/micro goals and calories on the same tab and could EASILY swipe through them to see if they were met. Now i have to waste time switching back and forth between tabs to see all that info. Why update it just to make it MORE inconvenient?? Would be 5 stars otherwise...",3,6
Crystal McAdams,2025-11-19T03:28:52,"this is a great app and really helps keep you accountable for what you put into your body. I've been using it since 2017 and have lost about 70 lbs overall with diet, exercise and this app. Last week I would have given it 5 stars but this latest update is terrible. I don't know what was broken before that they felt the need to ""fix"" it. it used to show your budget, total calories consumed and your net after exercise. it no longer has the ""net"" and looks totally different and not in a good way.",3,3
Carlos Noguera,2025-11-21T01:13:31,The only reason why i subscribed annually was to log my fats. sugar and protein on the log section of lose it. now it only allows to track 3 nutrients instead of more like before. it even says on the settings section of lose it that only the top 3 nutrients will be shown on the log header. how can I make it where it showed everything like before? its a major inconvenience to go to the dash board now and having to do so much just to see the nutrients where before they were at a glance on the log.,3,3
Patrick Shehane,2025-11-11T16:22:46,"Premium still has ads, minimal reporting of nutrients like calcium. To explain: I paid for the lifetime and everything, but it still pops up questions about paying for more things. And, one is even ""a gift"", but when you look, they are all external paid-for programs with a 'gift'. It is all very distracting, and a premium lifetime user should have have to constantly dismiss these. Further, after diligently entering all my food, i cant get back how much calcium or iron consumed.",3,6
Rufus,2025-11-26T21:05:36,Disappointed in the Android version. The Health Connect integrations are not as complete as they are in IOS. I have blood pressure and hydration being logged to health connect and other apps read it. lose it is not updating the log. I recently switched to Android from iOS and I can say the iOS lose it app is less buggy and more complete. Im a lifetime premium member and have been using lose it since 2016.,3,1
Adri Z,2026-03-12T17:38:59,"A battery draining app! I really liked the UI on the app. It was simple and had all the food choices available. I went from a 100% battery to 32% in 20 minutes. I removed the app and have had stable battery since. I was only able to use it for 3 days before realizing it was the reason for my dying phone. fix the issue and I will return, please.",3,1
Catherine Williams,2025-12-05T16:41:54,"The advertising has become less aggressive, but the adverts still go on too long. I find it's actually quicker to click out of the app & go back in than watch the whole add, which surely defeats the object of the advertisers. If they made the ads shorter they would be less annoying & id probably watch them.",3,106
Mary Schtakleff,2024-03-21T16:29:47,"Update: I left the app for some time and when I came back I assumed the many recipes and foods I added would still be there. I was wrong! Everything I painstakingly added is GONE. What's the point of having an account then if your information doesn't stay? Original: I have been using this app for slightly over a week and I absolutely love it, especially compared to the S Health app that came installed on my phone. The barcode scanner has been incredibly accurate in my experience.",3,2
Greg Segda,2024-04-26T22:27:48,"I've had to edit my original review. ""This app is easy to use and add food and exercise. I only wish I could sync it to my sports tracker account. So happy they put the reps back."" A lot of this is true and it helped me to get to where I wanted to be. Here is where it has lost stars: They have moved some of the previously free features behind the pay wall. I can no longer scan food in. The heat maps are a thing of the past. It doesn't allow me to sync my fitbit. Disappointing.",3,24
Jess H.,2024-06-28T21:59:31,"I really, really wish counting Added Sugars was available in the way that counting Fiber, Saturated Fats, or Net Carbs are. Unfortunately, it is not even an option when filling in the nutrition info for foods. If the American Heart Association and others recommend a certain maximum amount of added sugars, it would make sense to add that sort of information in the same way they do other micros for tracking. Otherwise, I enjoy the app. I have not had any problems with it linking to Fitbit's app.",3,8
Richard Wright,2024-04-21T15:45:21,"I liked the recipe feature in the paid version and easy to use interface. The database contains lots of inaccurate items making it difficult to select. Many entries don't contain nutrient data. There is a ""verified only"" switch but drastically limits the choices. It's a good value IMO if you don't mind wading through the data.",3,0
Stevie O'Malley,2024-02-29T18:50:32,"I've used and loved this app on/off for years and it helps me stay on track when I'm wanting to watch my intake. I've gone back and forth bw the free & premium version, depending on my situation and needs at the time. But CONS: • No way to mass delete old recipes. • It was a stupid idea to make the barcode scanner a part of premium when it has been a basic/free feature included for years. • The pressure / pop-ups to switch to premium has increased & gotten a lot more annoying.",3,3
Shawn Wilkes,2025-01-12T02:59:33,"I needed an app to count my calories, and tried a few different ones. This one had a good deal for a year-long susceptibility, so I ended up getting it, but there are a couple of issues: 1. I already paid for a year-long subscription. Stop advertising the life-long subscription every time I open the app. It's annoying. You already have my money, so stop asking. 2. The system for adding foods isn't as good as some other ones out there. Would be nice to auto-add estimated nutrition for new foods",3,67
Joey Mateer,2024-10-15T05:56:16,"As others have mentioned, the ""Done logging"" toggle stopped functioning properly. I have to close the app and then select ""Done logging"" for it to work, and in doing so it pops up a full screen ad that didn't used to exist prior. So the issue seems like the app is just failing to open the ad when selecting ""Done logging"", and thus not completing the toggle process. My advice to solve this, get rid of this unnecessary intrusive ad spam.",3,17
Mandy Walton,2021-05-16T15:53:34,"I love the update, adding food is easy. This app allows me to keep track of my calories, water intake and macros also. **Note that I have the premium account. However, keeping track of my weight loss is a little discouraging. The graph shows my weight loss but the numeric proof is not calculating correctly.",3,0
A Google user,2019-02-24T15:38:00,"I purchased the Pro version to get the exercises. However, the pictures are so blurry you cannot tell what you should be doing. I emailed them but no response. Also bar code scanner is slow to come up. Calorie tracking is good & is on the free version. Overall, for me, it's not worth what I paid for the upgrade.",3,0
Phoebe Snyder,2024-10-01T00:40:10,"I used LoseIt for 2 years and lost ~45 lbs! This was a great app to build the habit of tracking - easy to use, simple interface, large database of foods. I hoped it would update with new features over time that allow you to get more out of your data but I never saw much improvement. Now that I'm further along in my fitness journey, I need more data insights and integrations. I switched to MacroFactor and love how much more advanced it is. Still thankful to LoseIt for helping me get started!",3,5
Edgar Barraza,2024-04-09T00:33:19,"This app used to be one of the top weight loss apps you can get. It had a lot of features that were free and they didn't bug you to upgrade to the lifetime all the time. Recently decided to get back on to lose some weight but the app bare Bones does just the bare minimum of keeping track of calories. Also the database need some work, if you look something up you'll have to dig through the many many entries to verify you're logging the correct item. Also would be nice to have recipes.",3,67
Peter Ochalek,2025-01-22T03:34:05,"I used this app for several years, and took a few months off it because I was sick. It was great, and even free it had everything I need. But I've come back to it and found that the barcode scanner is seemingly pay-walled? Every time I try to use the scanner it just prompts me to pay for premium. Maybe this is a bug that's being caused by the sale but I can't use the barcode scanner for free and honestly that's a dealbreaker. Almost every other fitness tracker app I know let's you do it for free",3,2
Leanne Parker,2024-12-29T20:02:28,"Needs custom macros .... overall I like this app, but I do not like that their ""custom"" plans cannot be customized. The high protein setting is not high enough for the macros I'm trying to hit. It is 90g and I need 130g setting. Looks like they used to have the ability to customize and removed it for some reason. Please bring this feature back.",3,4
Mark O'Keefe Jr.,2021-05-28T13:35:48,"Look, I really like this app. Unfortunately ever other thing I look at in it is something telling me how I should upgrade. Please give me the ability to remove the adds. I'm NEVER going to pay for an app annually. If you want to charge to unlock for features that are basically addition, subtraction, and sorting, fine, I'll pay once for that, but please stop accosting me ever time I open your app or add a meal to upgrade. It's really annoying. Other than that it's really a great app.",3,4
A Google user,2019-10-14T23:33:17,"The layout and general setup were ok but a lot of the nutritional info was incorrect, even when scanning barcodes. Also a lot of items forced you to log in 'servings' instead of allowing lbs, fl oz, grams, etc. ...So if I'm logging a potato for example, it makes me say how many servings I had... I don't know what a serving of potato is, but I know the weight of the potato I had so it would be a lot easier to just be able to enter that.",3,0
Willy H,2021-06-08T15:44:34,"I wish there was some way to export the data in to excel (.csv) All the foods, times, and calories, carbs, fats, data are locked in the app. More convenient then a note book I guess. 48 days straight day logging and now I would like to examine the data but I can't. If I could export all the trapped data I would purchase the app. I guess I'll keep using it while looking for an app that has useful reporting... I can do the basic math myself.",3,10
Meredith Rice,2021-12-12T04:44:11,"Okay for calorie counting, less so for nutrition. Will not let me set my own daily calorie ceiling or date at which I want to reach my goal weight by, just weekly loss rate which isn't important to me. No point in adding vitamins since it doesn't log minerals. The macronutrients it does track are very basic, even if you pay to see more. Often the barcode scanner brings up information on the wrong product or shows no results at all. App is locked to dark mode if your phone is using it. Ugh.",3,9
Stacey Trombley,2023-12-07T01:31:52,"Eh everything costs money now. Not just this app but all of them. I just want a simple nutrition tracker, not just calories. I'm trying to pay attention to protien intake and fiber as well. But you can't see that on any of the apps I've found without paying. That's okay, it's not that hard to keep track yourself just takes extra work. I'm not paying for that.",3,7
A Google user,2019-01-09T20:13:24,"This app isn't much different than many of the other apps I've tried. Lost 10 lbs with my fitness pal, but I set this app to lose 1 lb a week and in four weeks I've only lost 1 lb! I didn't even include my exercise which I do 5-6 days a week, so I've been under their recommended calorie count and still haven't lost the 1 lb a week they told me I would. I also don't like the subscription model. My fitness pal included many of the things this app wants to charge me for.",3,1
William Kimble,2020-05-07T20:03:57,"Pretty good... but one big flaw (for Android). Me and my wife eat a lot of the same meals, but there is no way to share the details once all of the entries are made on my phone or hers. So, we both have to enter all of the same details. It would be much easier if she could just send and I import into whatever meal I need. Also, it doesn't I directly integrate with Samsung Health. With all of the Samsung devices, I would expect that integration to be there. Other than that.. app is pretty good.",3,7
Stephanie Hilton,2025-06-06T08:17:08,"Good app... but only if you pay for the premium package. I did the 7-Day free trial and really enjoyed the scanning option, but wasn't sure I liked it enough to pay for it, so I switched to the free version. Because the Fitbit connection is free on most of the other ones I've tried, like MyFitnessPal, I did not anticipate that if I didn't pay for the premium, that I wouldn't even be able to track my steps at all. Really disappointed that I can't even add them manually. Kind of useless now.",3,5
G Music,2022-12-29T12:52:29,"Quite a good app but the ads are worse and worse all the time. I literally have to close the app to make the ad go away, and then open it up again....several times just to input a single day's data. PLEASE DO NOT TELL PEOPLE TO PAY YOU $ TO REMOVE SOMETHING YOU SHOULD NOT HAVE PUT THERE IN THE FIRST PLACE. It's like punching people and then saying, ""No problem. Just pay us to stop.""",3,1
Nicole,2021-12-28T22:02:16,"Used for awhile And it was great. I stopped using and recently began again, however the app's exercise options are going wonky and I can't figure out why. I try to input my walks on the treadmill, using my own calories lost and duration, and its giving me crazy calories lost numbers- in the thousands! It won't save my input. What's up with that? I can't use the app now because it keeps logging 2,700 calories lost for a 30 minute walk lol. Once that gets fixed I'll get back on it .",3,1
Chenoa Hyson,2024-02-10T03:12:13,"This is the best weight loss app I've used so far. But I have one complaint. I've been using Lose It for literal years (almost a decade). I use the basic version and not the paid version. I went to scan a food item today and apparently I can only do that if I pay now?? What the hell, man? That used to be one of the best features of Lose It, & anyone could use that feature, and now you're telling me you've yanked it from basic users & only premium users can scan food now? What a money grab.",3,0
A Google user,2019-04-06T07:38:59,"Okay 3 stars. This app is really great for keeping track of what you're eating! its got the scanner that recognizes real store barcodes and can really help you to understand and control portion sizes. However, this app is seriously lacking in the community factor. Support groups/friends are one of the biggest parts to a successful weight loss. App needs some major updating to the social aspects such as finding groups/people and being able to smoothly connect. (and only email notifications 👎)",3,1
A Google user,2018-11-28T08:15:11,Not a bad app but not the best. What I really need is to see how many macros I actually have left without having to click on them individually. That would be extremely helpful. I see what they did with displaying them when you click in them but I'd love to he able to open my log and see how much more of each that I need to eat. The database has almost everything in it that you can imagine. I am a premium user because on black Friday it was on sale for $20 for a year. Too cheap to pass on. I'll put up with my small gripes but aside from that it's a good app.,3,2
Brian Chadwick,2021-02-20T15:44:36,I have used this app for several years. I recently stopped paying for premium. I like the app but it's too glitchy to spend money on it. Too often it stops syncing with Google Fit. Food I enter into My Foods goes away. Sometimes weight gets measured in hours. My exercises are not in the app. I think developers have a right to charge for their product but I don't want to pay for a product that is not dependable. I don't really want to spend money just to be frustrated.,3,22
Matt P,2021-08-31T18:01:55,"I want to like this app. Most of the time food is easy to enter and the barcode scanner is the best. My problem is that the choice of measurement options doesn't work for me. My food scale has grams and ounces. Lost It doesn't always give those options. I don't want to convert grams to cups when I enter a food. If that doesn't bother you, I recommend you give this a try. It's unusable for me.",3,9
Michael Fardella,2022-08-14T03:58:38,"TL;DR: To lose weight, you need to track more than just calories, and you need to double check the macros on the app. This app is good for the most part, but you NEED to double check anything you didn't log yourself. Because everything on the app is added by normal people, it can be very inaccurate, even if it has the ""Verified Check"". For example, when logging Jersey Mike's subs, even the ""Verified"" sandwiches were sometimes off by almost 100 calories, or by 11g of protein. Just ridiculous.",3,21
Katie Parker-Singh,2024-06-22T20:28:08,"A lot of the ""verified"" items are wrong. The calorie and nutrition numbers are lower on the ""verified"" items than on the actual packaging or company websites. Why even have ""verified"" items? I see no option on the items to report they are wrong either. I wish there was a drink category and dessert category rather than just breakfast, lunch, dinner, snack.",3,7
A Google user,2018-11-09T03:51:10,"For years, this app has done a fine job helping me track foods I eat throughout the day... but lately it's been nagging (and I mean NAGGING!) me, sometimes multiple times a day, to upgrade to the premium level. It's to the point that I almost no longer want to use it, and may stop recommending it to others. Ease off the nagging, Lose It!",3,2
Patti Yohe,2025-05-02T20:29:32,"Lose It app was perfect 4 years ago except for the thousands of ""foods"" that people entered incorrectly. Some of the ""foods"" were just made up! calories are way off. You can stop that problem by entering everything yourself. However, Lose It app brags about the ""huge number"" of foods in its database. Most are duplicates or are made up/incorrect. Manufacturers update their recipes and packaging, the ""foods"" on the Lose It app are never updated. This is why they have so many foods listed.",3,22
K. Murphey,2025-04-07T12:49:50,"I love a lot about this app. I'm switching my strategy now to focus more on macros. I wanted to customize my goals. The process to set customized macros is needlessly confusing. For some reason, it isn't in the same location as ""Goals"". Instead you have to go to your log and click on the specific macro, click settings, and then set it. Why? Just, why? Why make it more difficult and unintuitive. I was half a second away from switching apps, but luckily I figured it out.",3,1
