userName,at,content,score,thumbsUpCount
Cheyenne,2023-12-10T20:54:31,"I used to love this app. I used this app for years, and I always came back to it after taking breaks from dieting, but it seems like everytime I come back the app gets worse. It's super slow, theres ads everywhere, and everything is behind a paywall now, even the barcode scanner! And premium went up in price! The price it was before was still not worth it for what you get. At this point, I'm better off getting a journal irl and writing down my intake/excercise/weight. This is ridiculous.",2,79
Bridget Donnelly,2024-02-12T13:05:57,"Buggy functionalty for logging exercise ('cooking up an update' for 30sec after every single entry for months now), not to mention barcode scanning getting paywalled when it's free on so many other apps. I'm a long-term user of probably a decade and wanted to purchase premium this year. The ads were fine, the loss of free scanning was annoying, but the freezing after exercise inputs is intolerable. I'm a creature of habit and really hate to switch, but LoseIt just isn't functional anymore.",2,42
A Google user,2018-09-22T20:06:34,So easy to use and understand. Tracking is totally up to you but by being honest you will achieve your goals. This has helped me lose 50+ pounds and will help me get to my final goal and during maintenance. Recent update has improved scanning of foods so much faster. This is by far the best app I have found for food/exercise/challenge tracking. Please PLEASE fix the scanner. I do not have 5 minutes to wait for the scan.,2,3
Sean McKenna,2023-02-07T19:49:10,"I used to love this application because of it's fair premium price subscription compared to competitors and it's simple, utilitarian vibe. It honestly helped me lose 70 pounds. But lately it has been crashing on the most important of functions - adding a food. So disappointing that if this isn't fixed, I'm going to have to move to another service. In it's current buggy state, I would not recommend.",2,69
A Google user,2019-01-27T22:18:16,"Once was great, but has recently started aggressively pushing the premium service with pop-ups. I tried premium for a year, and found that it added nothing special if you're just tracking calories. Now nearly every day I'll press the icon to add something, only to have the premium ad overlay pop up directly where the icon was, and take me to the premium sub page. At this point, I'm too invested with custom recipes and meal history to switch. I get it, you can't develop an app for free, but I'm no",2,8
Patricia Barnes,2023-03-15T14:58:05,"Used happily and successfully for many years. Didn't mind the ads until lately, they are now beyond intrusive, they hinder use of the app. Sadly deleted the app and am here shopping for an alternative. Yes, I tried the paid version for a year and did not need the features and can't justify the cost in my budget. Hoping to find an app that plays nice with Samsung.",2,0
A Google user,2020-04-08T16:55:59,I've used this app for years and I really like the usability and interface. It always allowed you to connect your fitness tracker to it to keep track of calories burned. Now all of a sudden you need to have a premium subscription to connect your tracker. Really disappointed and will probably use a different app now that has kept that as a free feature. Shame.,2,35
Preston Bowman,2020-04-29T22:37:16,"I really wanted to love this app. It's beautifully designed, but to get to micronutrients you have to be premium. Ok. But then when you use the barcode scanner and the only data you get is calories, it's a little disconcerting. The database does have a verified filter, which is good, but there are a lot of discrepancies even when you use that. I guess it's back to MyFitnessPal for me.",2,0
Kurtis Davidson,2023-02-17T23:00:23,"I've been using this app an extensive amount of time (6 years) and have found it very useful and easy to log both food and exercises. Recently, pop up ads had been introduced and are extremely intrusive. When adding an item an ad will pop up and only some of the ads are skipable. I completely get that it's in a businesses best interest to monetize but the number of pop ads have made it harder to justify the use of this app. Editing nutrition of an item after scanning it is also broken now.",2,102
Susie H,2024-05-01T13:37:23,"No love for the forgetful, too fat folks. 💔 I used to weigh in the 100's, now 200's. After tracking for a good stretch, I'll forget and put 100 something instead of 200 something. It will think I've reached my goal. So I have to start all over. I wrote to LoseIt and was told fixing this is low on the list of their developers' priorities, and it is not likely to be fixed anytime soon. I pay for Premium annually. I'm looking around for something better without that flaw. I do not feel seen.",2,3
Julia Pierce,2022-11-09T14:28:26,"I have used this app for awhile now, it is mediocre at best. The most frustrating thing for me is that if I create an exercise it doesn't stay at the calories I originally input. I know they change because when I create an exercise I input the calories burnt in the title. For some exercises I created awhile back the variance is as high as 10 calories. All together I have noticed subliminal changes that, in my opinion, are done to try and get the user to invest in prime membership.",2,19
A Google user,2019-04-09T06:02:35,Not your best choice for counting calories Entering data is easy and intuitive but trying to analyze the data is tedious. Their support articles do a terrible job of explaining how to do something. If you are serious about tracking your macros and understanding which food specifically got you there at the end of the day you'll want a different app.,2,4
A Google user,2019-06-23T20:27:14,"It looks OK overall, but the foods are usually not listed in grams, which is too annoying. When counting calories, it's easiest to throw the food on a scale and then calculate based on that, rather than trying to figure out tbsp or whatever. Almost every label lists servings in grams, so it should be in the database. Also, the app doesn't seem to let you define a manual calorie target.",2,39
Hope Duncan,2023-03-08T22:03:38,"Had this exact app years ago. it has changed. I will be looking for a different one. It seems like the just try to make it more and more complex and it doesn't need to be that way, and that's just the free version. there's just more piled on with the paid version. I need to simply record my meald for calorie counting, be able to change things to what I want rather someone else finds my goals unreasonable, that's not for you to decide. and then record my weight. The other things aren't needed.",2,85
A Google user,2019-07-31T03:24:14,"Good-ish, but has some issues. It says you can adjust calories on the ""daily calorie budget screen"" by using the adjustment field... but that is not possible because there is no adjustment field. No mention that it is only for the premium service... So frustrating. Often gets stuck searching for a food. Some barcode scans can be adjusted which is helpful, but some are juat plain wrong and I cant adjust. Ugh.",2,7
A Google user,2019-08-31T23:27:39,"I had downloaded this app and loved it! BUT, I changed phones and had to reinstall it and suddenly to track my protein and carbs, I had to upgrade to premium. I kept the app anyways, just to keep track of calories. Didnt use it much, switched to a different one. Out of curiosity one day, I opened it to check if maybe they allowed carb and protein tracking again, and they not only didn't, they had raised the price! No thanks!",2,0
John Cruz,2021-01-21T03:56:34,"Used this app several years ago to track carbs and meals. Bought the upgraded version even. Extremely annoyed to return to it to discover that most of the useful features (configuring meals per day, carb tracking, etc.) that used to be free are now behind an annual subscription, and no way to just go back to the old version where these things were free. Massively overpriced for annual as well. Greedy. I'll be saying ""nope"".",2,16
Ryan Cale,2023-11-29T18:46:17,"Fix your app please. I actually really liked it at first and wanted to purchase premium, but now... 1. The app recently started acting super sluggish and is now frustrating to use. 2. It used to put the foods I've entered before at the top of the search results, but it's not doing that anymore for whatever reason. It takes longer to enter meals now. 3. The ads have gotten overly intrusive. Please vet them better. I've gotten ads that have no obvious way to close them besides restarting the app.",2,22
TrashZone,2024-12-23T11:59:39,"Been using the app for over a year and loved it! I even paid for the subscription. However, as of roughly a week ago, the app keeps crashing whenever I try to open it. I've tried everything I can think of- making a new account, reinstalling the app, clearing the cache and my storage, and even making sure the app is updated, but nothing has worked. Even when I delete and reinstall the app it crashes whenever I try to open it.",2,20
A Google user,2019-01-19T18:06:30,"Have loved this app but over the past few days, I haven't been able to search for ANY foods. I try to keep up with my calories pretty well so it's unfortunate when the app pretty much just quits working. Doesn't bring up any foods when I search for names or barcodes. I have updated, restarted my phone & the app to no avail. I hope that Lose It! fixes this issue soon!",2,11
Kousuke Kanzaki,2024-08-01T13:04:33,Used to be good. This app went the way a lot of popular apps do and started inconveniencing it's users in hopes that they'll pay for features that were previously free for years. They took the most used features and put them behind a paywall. You can no longer scan barcodes to log them. Something that's free in almost every single app like this. I used to recommend this app to everyone but I unfortunately have to move on. Yet another service trying to be a subscription. Really disappointing.,2,34
Ron Taylor,2025-09-13T01:59:12,"I've used Lose It for years now. I have a premium subscription. The most recent update is *terrible*. When you go to add food items to your meal, there is now so much whitespace around everything that only *two items* are visible with the keyboard up. I use My Foods constantly because I can't trust the community items, and it now resets to ""all"" *every time* (maddening). I regret my lifetime purchase now, it's so much more frustrating to use.",2,7
Shelby,2024-07-15T01:38:51,"This app is actually the only calorie counting app I like because of its layout. However, why do you have to pay for everything now a days? You used to be able to scan for free, and I really don't mind that because the nutritional value is on the same package anyways, but to have editing the calories payable? Why? It just doesn't make sense, and I'm not mad about it, but I just find it so dumb. Are they going to come to my house and force feed me the remaining calories? Mynetdiary is free tho.",2,2
Jereme Schulz,2025-09-17T20:11:58,"the app has a lot of data points, almost too many. it made navigation difficult. furthermore, syncing with my Samsung health app, steps, and weight was spotty at best. I had to manually enter all my data that is being recorded elsewhere, so it took more time than it was worth to use. I even paid for the premium app and still cosmetic get data to sync properly.",2,38
JB,2024-07-27T13:12:00,"Amazing app that has helped me lose weight and maintain it, but as of late I have noticed ads are starting to get bigger, more obtrusive. I could ignore them at first; however, now I'm getting ads after every meal log and it's way too ridiculous to ignore. That will not make me want to pay for your premium services, but to only delete the app despite have using It for years.",2,16
Leh Merc,2022-12-22T23:40:25,"App itself is fine. I use it daily and would have given it 5 stars for being easy to use and having a simple to read UI. I give it 2 because after one of the latest updates, it went from small ads that you could avoid to fill screen unskippable ads. It's clearly predatory. It's not enough that the pay version has tons of features, now they are trying to force it will massive ad vids. My advice is just close the whole app if an ad starts. Otherwise, use something else.",2,27
Spooky,2024-09-10T19:16:48,"Was a good app for the first week before I realized how difficult it was making things. So many options for the same dishes but each with significantly higher or lower calories, doesn't make sense. I wish it showed the ingredients and measurements, but it doesn't so it's difficult to get an accurate calorie count. Also when I edit the calories for 1 serving. It shows the same calories when I multiply the serving, example after editing 1 serving to be 70 calories, it's still 70 for 4 servings.",2,11
A Google user,2019-04-24T03:51:05,"Used to be much better. Now the app tries to get you to subscribe to their premium version with every click or opening the app. Gets annoying esp when you're on the run and wanna just input something quickly. Also, they removed calories by macro (protein,carb, fat) and now just leave you with a % so you have to do the math to figure out your macros (now a prem feature). every update = less free features. Going to uninstall this version to replace with an older update I found online. Disappointed",2,4
ML /FK,2023-04-13T16:40:26,"This app has been my favorite food tracking app, but recently the ad banners are very glitchy and continuously bounce between different ads of different sizes, affecting the usability of the app. Because the screen jumps out around due to the different banner sizes, scrolling through to review your food intake of the day has become nearly impossible, and you can only add food through the ""+"" icon.",2,0
Joshua Roles,2023-09-29T16:35:45,"This is a great app most of the time; however, the widget that displays calories seldom let's me click on it to add calories. I have to keep the actual app beneath the widget to add calories, otherwise it exits out. Additionally, it links to every other health software excluding Samsung Health. I have a galaxy watch, and I find it rather annoying that I have to manually enter my workouts because the app doesn't allow connection to Samsung Health/products.",2,1
Meredith Haldeman,2020-05-19T19:23:06,"I used this program years ago on my computer and really enjoyed it. I reinstalled it today but I can't use it. I'm legally blind and if I have my font sizes turned up on my phone, it cuts text off Lose it or it still keeps much of the text at a default small size. This is just the lastest in a long line of apps with disappointing or non-existent accessibility features.",2,0
Lauren Parsons,2022-12-01T15:14:32,"I loved it at first. Because weight is such a struggle, I started with a smaller goal, with the intention of later adding more. After reaching the first goal, I reset it to my new goal weight. I was prompted to choose ""keep data"" or ""clear data."" I chose ""keep."" My data was still erased. I was paying close attention to specific eating habits and foods, at the direction of a healthcare provider. Now I have lost nearly 2 months of food tracking, taking away valuable information for my next visit.",2,6
Seth,2022-02-09T08:42:14,"Very simple to use but, it can get a little tricky at times. I think it would be a much better experience if they added some features such as ... 1) CSV import/export for weight, 2) Sync water consumption with Google Fit (for premium users), 3) Add an app for WearOS smartwatches for quick & easy access, 4) Quick add option so it is faster and more convenient than searching for a specific item.",2,23
Carol Johnston,2026-02-04T18:27:59,"I've used the free version of this for years and it's always been helpful. I echo others' frustration with the last update but it's the ads that are the worst. I expect ads, of course, but they've become more frequent and some of them can't be closed or backed out of - I have to close and reopen the app to get rid of them. Even worse is the very spammy/scammy nature of some of the ads - alarming ""warnings"" about your device with instructions for supposedly fixing it. It's inexcusable.",1,27
Peter Sannicandro,2026-01-22T20:14:08,it's still a great app in theory. it's just incredibly glitchy and slow as it freezes constantly. if I didn't own the app I would probably switch to a different platform. edit lowered to 1 star. the app constantly crashes. You can't even log a meal without having to restart the app over and over because of constant crashing. Save your money and go with a better app. I feel bad for the people who were swindled into buying this with a one time purchase.,1,13
Roy Taylor,2026-01-15T10:09:12,"Edit: the new UI update is sluggish even on a new phone. I don't know what they did, but it sucks. original 5 star review below; Quite an amazing tracker. Syncs with all the fitness wearables. Allows for a LOT of customization for the metrics you want to track/goals you want to set, but it's not too complicated to navigate. Reasonable price when compared to services like Fitbit Premium (which sucks, don't buy Fitbit.)",1,8
Juan Munoz,2026-03-10T17:22:38,"Used this app a couple of years ago when it let you scan the barcode of the things you eat. No intrusive ads, no frequent, in your face, ads. Now, every other meal you input makes an ad pop up like a mobile game. While I like the app and still use it, I cant recommend it because of how bad the ads are now.",1,5
Jen,2026-02-01T17:19:55,Ive stopped using this app and dont recommend it anymore. I wish I never paid for the premium subscription because at some point they changed how you view your daily log of nutrients. It was once easy to scroll through all of them - now you only get your top 3 to view in your daily log and everything else you have to go into multiple pages. it's inefficient and a huge PITA!.,1,10
Angel Quinones,2026-02-06T16:24:50,"I don't know why you guys got rid of the little floating + button where you can hit it and start adding entries. I used to use it everyday to log my glucose and my food. Now the button is gone, and I have to fish for where I have to put my glucose entry. I don't know why you would remove functionality from an app that was being used every day.",1,14
Kevin Reed,2026-02-05T21:56:03,used to love this app but it has devolved into a piece of trash. when you try to add foods (add foods from yesterday) it doesn't add all even though everything is selected in the menu. other issues as well. trying to add stuff and it's interrupted by poorly paced ads that pop up in weird places. zero stars if it were possible!,1,4
Jason Jayne,2026-03-06T01:26:34,"Not a fan. Everything good is locked behind premium. You can watch ads to unlock certain features but half of the time the ad doesn't let you exit out, so you have to close the app and try again. They offered premium for 20$ for the year, but now when I try to buy it they want 80$. This is not worth 80$.",1,2
Madelyn Green,2026-03-30T23:49:55,"I returned to this app- it has way less free features now, not only that, when setting it up, it asks you if you want to add things to your ""plan"", then at the end of set up tells you that you need to pay to include what you selected when setting up.. Why not be upfront with the fact that it costs money instead of wasting user's time by making them think these things can be included in the plan? Membership seems predatory by the way it is always ""on sale"" for different prices for different users",1,2
Kevin Blackledge,2025-12-04T23:04:50,"I've been using this app for many years and am a premium subscriber. The latest update is horrible, full of bugs, and difficult to navigate. It has lost a lot of my recipes, search is broken, and it won't show many past meals when I'm trying to add food to a new meal. I want to revert to the previous version. if that's not possible and this isn't fixed very soon I'm canceling my membership and finding another app.",1,12
Ron G,2025-12-23T23:34:03,I have been logging with this app every day since September 2012. It has worked very well and helped keep my weight loss program on track. UPDATE: 7/11/25. lately the ads are becoming extremely annoying! Once they pop in you need to close and reopen the app. I have been using this app for many years without any problems. Very disappointed to say the least. UPDATE 12/23/25 The ads have become so annoying that you need to close and reopen the app to get back to make entries. APP IS NO GOOD.,1,33
Heather,2025-11-13T04:39:47,"Can no longer log in (did try to uninstall and then re-install). When I enter email address for password reset, nothing happens. It's correct email, where I was getting weekly logs sent. App had been glitchy - Google Fit data doesn't sync, water usage could only enter by typing in exact amount. Anyone able to help get logged back in?",1,11
Sasha Fletcher,2026-01-04T19:46:12,"This app is absolutely terrible! the onboarding is an endless list of unrelated questions that are frankly overly personal and unnecessary. you are a calorie counting app, you do not need to know who I live with and what I do on my free time. After spending nearly 10 minutes answering question after question, you get to a deadend if you already have an account tied to your email. So you have to start all over in a different flow. this app is not worth my time based on the onboarding alone!",1,6
CreeDo Lala,2025-12-07T15:51:15,"This app could be so good, but it's on the slide towards enshitification, they're making it worse and worse with every update and paywalling features that used to be free, like setting your budget. and if you pay for ad-free, you're still going to get an ad every single day for the premium version. it sucks to see good companies do this to themselves.",1,48
sundvl78,2025-11-07T00:15:32,"The recent update doesn't make any sense. It's harder to see your foods and more complicated to add them for no reason. They also took away being able to see macros at the top unless you pay for premium. With the ridiculous amount of ads I have to watch to use this app, it's not worth it so I'll be deleting this and using something else.",1,11
Nicholas Grugin,2025-11-12T16:56:32,"Simple interface no longer. UI has changed so much in the last year or two to be practically unusable on an android phone. I just want to add food an make sure I'm not over for the day, that use to be simple on here, now it's not. Accessibility has also gotten worse as they shrink text to keep trying to cram more stuff onto the main screen. Cancelling premium subscription on it",1,8
Tom Elliott,2025-12-13T02:54:49,I've used this app for years. 1600+ day streak of logging weight. I bought the lifetime subscription because I loved it. In the past few months the app has developed terrible input lag. there have also been UI changes that make the simple task of logging calories many more clicks than it was. Give me back the 2023 version!,1,6
Sophie / Nymh Calvin (DJ Isopod),2025-11-08T16:54:51,"I own premium. A UI update has made it so that the dashboard at the top of the log ONLY shows the top 3 nutrients you set it to track. I SPECIFICALLY BOUGHT PREMIUM FOR IT TO TRACK FIBER AND SODIUM *ALONGSIDE* MACROS, WHICH IT NOW NO LONGER DOES. It has essentially reverted me back to the free version feature-wise, leaving me feeling cheated considering the cost of premium.",1,11
Indigo Milkcap,2026-03-31T21:47:51,"it kind of doesn't.... work? I press buttons and they don't respond, or they produce errors that only go away when I restart. Additionally, the app let me use my account without me verifying my email first, which was strange. I didn't even open the email; it just glitched out, tried to make me go through the whole sign up process again, and when I clicked the back button it logged me in automatically. It was weird and I didn't like it.",1,1
Darth Vader,2026-01-11T17:55:30,"Absolutely abysmal new UI I've been a lifetime subscriber for 4 years now. It was an amazing app, the best Id used for tracking. Now its slow and glitchy, loading takes 5 times longer than before, half the time it can't research items and you have to close and reopen to add the rest of your meal. Its limited the amount of macronutrients I can see at the top(seriously?), so you have to change pages and dig for it. I have a sneaking suspicion its to be able to play an ad for the free people.",1,1
Levi Ruble,2026-03-04T06:40:12,Tried again because MFP is changing too much. Kept crashing trying to even get my account set back up. Wouldn't let me continue without buying an annual plan and kept going back to start setting up a new plan. 🙄 Missing too much. So many foods from chain places aren't listed. Tried scanner many times on different products and it wouldn't work. Inaccurate nutritional information on various items. Will go back to MFP.,1,0
Blakely W,2025-12-04T16:55:29,I used this app for about a year consistently. I used the basic version which didnt include scanning or some other detailed features. As time went on there were more ads but I understand they need to make money from the basic version but the recent update where you can't see your macros and can only see calories was too much for me. macros are the foundation of healthy weight loss and hiding that basic necessity behind a pay wall is infuriating. make it a paid app at this point its useless now.,1,4
