userName,at,content,score,thumbsUpCount
Colton S,2024-12-19T04:12:11,"I've been using Lose-It back and forth. I lose weight then I gain it and I come back. Each time has gotten easier than the last, and this time I'm on pace to reach my goal with the assist of exercise. The app has a lot of customization and plenty of features making it easy to use while also providing a lot of features. Having premium is in my opinion worth it, as the extra tracking helped me to reduce frequent cravings. overall it's a 10/10 for me. Beats any diet or cook book I've used.",5,350
Doug Osgood,2024-10-06T19:59:32,"The voice entry option is GREAT in the app. A lot of times knowing I can just rattle off the things I remember eating for a meal and that it'll get them right (including amount) super quick is a big thing that has kept me going. I DO pay for the premium version, but it also feels worth it. They have a lifetime premium option as well if that is something you are looking for. This app has grown a LOT since I had started using it about 15 years ago on an iPod touch 😁",5,196
Karen B,2026-03-30T23:23:49,"I have used this app for years and have the lifetimemembership. It has had some updates thst have had bugs, but they fix them pretty quickly. This app has helped me monitor my sugar, protein, fiber, cholesterol, and carbs to be healthier and discuss my habits with my doctors. I do wish it would do something when you hit a weight goal or a have a ""good week"". Other than that I really like this app.",5,13
Deborah Doyle Brown,2026-03-10T14:03:39,"I looked at a ton of tracking apps. This is the most complete and easiest to use app for tracking foods, weight, water, sleep etc. It's so easy to use. It includes ways to enter your food with voice or a photo and it's very reasonably priced. Since I installed it and chose the type of food plan that I want to follow, such as standard, keto, GLP-1 etc. it sends me tips and food ideas each day related to the plan I chose. Highly recommend! I love this app ❤️",5,3
Suavé ConnXion,2026-03-03T05:50:19,"Great app overall. Wish it had more stores that had certain items you'd be looking for, but I know it's impossible to get all the stores and all the foodsin the world. lol. If it doesn't have, let's say a restaurant item that you can't scan, I look for something comparable. Not an exact science but for the most part works with keeping you right around the calories the food may have been.",5,1
Alexandra Babb,2026-03-02T09:12:22,I've tried several different apps for food tracking and calorie counting and I like user friendly of this best. I find that snapping a photo of my food is probably 80% correct with what's on my plate and measurements. I have had no issues with scanning a barcode. I do wish there was more learning about different macros and how to eat better in each category.,5,1
Cindy Taylor,2026-02-09T17:07:31,"This app uses generic clip art pictures for food and food types, probably to prevent copyright issues, but it will let you upload photos of your meals and keep them with your logged meal. The nutrition info for each food item is specific and editable, as products change over time. The meal summaries and daily summaries are easy to view. I really like the simple method to track water intake, also, and the other tracking options offered, including custom foods and recipes.",5,1
Michael Prokopchuk,2026-01-20T22:40:59,"Great app, easy to find all kinds of food, can easily count your calories without paying for the Premium features. premium features include fasting timer, water intake, macro nutrients tracking, and much more little conveniences but nothing that's required to be successful in tracking calories. Also it's really cheap as well since they always have deals for it.",5,2
Alex,2026-03-11T17:22:30,"I have an older phone (Galaxy S10+), and the most recent update fixed a lot of the odd lagging/crashing that was an issue before, so I'm really happy about that. I really like the look of the new UI as well! Thank you for continuing to update and fix issues with the app. I love LoseIt, I've bought the lifetime membership and its absolutely worth it. I've been able to lose 10 pounds since December. 🎉 I'm going to keep doing my best!",5,0
Kaitlyn Hull,2026-02-18T16:29:18,"so far so good! It's definitely a challenge sticking to 1,500 calories. But this app helps to keep track of them and I really like the food search option. I also love that you can scan the bar code on the food you're wanting to add and it will pull up all the details and nutritional information. Super easy to use so far and I already lost a pound!",5,0
Adina Rae Flynn,2026-02-01T04:17:44,"easy to use. free version is great and I've used for years. but now that I'm consistently and obsessively tracking what I eat, I signed up for premium so I could plan ahead instead of just track the day. great food descriptions and very thorough plus you can scan upc e en with the free version, create recipes, add foods.",5,1
Myron Jackson,2026-01-06T17:07:22,"this is by far the best app I have used for calorie, counting and weight loss. It is incredibly easy to use and offers many ways to log the foods you are consuming. it's very easy to adjust quantities. it has many extra features that you can choose to use which allows you to customize it for your diet plan. I appreciate the carb counter. It can also track intermittent fasting easily. upgrading to ad-free was quite affordable and well worth it.",5,3
Chris Herren,2025-12-09T00:09:33,Just a brief review. I've been using this app for about ~1.5 years. It has a lot of features that make adding your calories quick or mindless compared to other ones ive used. I have tried just about every counter on the market. I have requested would be more organization for the user created recipes. I have a lot of recipes and it's just a giant list that is hard to navigate. The search option also seems faulty. Please consider adding folders or other options! Thanks for the great app.,5,75
Jo Ackley,2025-12-13T17:51:20,"I love this app. I started with the free version and tracked my meals for over 800 days. It's easy and accurate. I love all the pop up encouragement when you meet the 5lb loss increments. I've lost over 200 pounds already and just purchased the premium version to help me start tracking certain things, like protein, more in depth. If you are on the fence, get it.",5,2
MEE Ryder-Robb,2025-11-20T09:45:55,"This is the original review from 2020. Now in November 2025 the app is suddenly changed, it used to show your net carbs very distinctly and now they've changed the interface and it's not as intuitive anymore. 2020: Easy to use, I recommend getting the paid version as it will track your net carbs. Easy to scan barcodes if you eat processed foods. Recognizes seemingly thousands of different foods when you type it in!",5,4
Raymond Black,2026-02-11T15:08:20,"I reported a bug using the email address under the Support option here. I got an automated reply saying the email was unmonitored. Maybe don't put that address there, then? The bug is now fixed: Add yesterday's meal feature, which I use for breakfast, is dropping selected items. It's been doing this for about a week.",5,12
David Pohlabel,2025-10-28T17:09:29,"This is a great app to use for tracking calories. Very easy to use, and almost anything you can eat is already pre-built into it. It can interface with Google Fit and calculate how many calories you have burned through exercise, and adjust your calorie budget accordingly. I started using this in March of 2025, and by September I had lost 50 pounds. This app changed my life. 100٪ recommend.",5,7
Julio Lajara,2025-11-05T20:36:32,"Awesome app with a few small rough edges. It has a few bugs in that doesn't always total up the nutrition info correctly if you use some units of measurement and it could really use a feature to export all your food with nutrition info, recipes, food log, and the data graphs into a PDF or HTML file so you can keep a record or share with a nutritionist/dietician. They also need a feature to report bugs or issues which I can't find anywhere.",5,2
nurse dianne,2024-06-10T00:44:40,"Very easy to use app. There are so many precancerous options,which make entering what you ate,easy. I was able to look back,and see,areas I need to change,like cut carbs,increase protein intake. I am able to see daily,if I'm close to,under or over my goal for calorie intake. I also used the groups for support ,increased my activity and was able to lose weight easier ,with this app.",5,2
Whitney,2025-07-28T05:10:41,"It's been about 6 years since I used a calorie counting app, (MFP is the reason I never tried another until now). I love this app so far. It's been a week and it's really helpful to be able to log foods so easily. I remember spending hours creating recipes on My Fitness Pal for simple foods. My one suggestion would be to add a few options. I'm breastfeeding and require a couple hundred extra calories a day due to this. I wish I could include that info to better customize my weight loss needs.",5,3
Ray Phillips,2024-12-16T21:05:57,"Recorded over 850 days, now its just part of the lifestyle. I haven't tried to lose weight in over a year, but I continue to use for tracking macronutrients and their balance. Works great for weight control too. The database is extensive, and the scan feature is spot on. A great feature I use is having a weekly report emailed to me that I add into an ongoing spreadsheet to better evaluate my progression and to identify any negative trend in my diet.",5,6
Ed Buckingham,2025-01-06T14:54:47,"I have been using lose it for about 2 years to maintain my weight and have been successful. the app is easy to use and has a large data base of all kinds of foods and if any food isn't included, you can scan the QR code to get that food included in the data base. you can also enter food items with a voice option. there is also an option to include exercise calories to increase you daily allowance or not. it tracks weight, exercise, blood pressure and water intake. It is a great app.",5,12
A Google user,2019-02-06T01:32:13,"Excellent app!! It makes counting calories suck less. It's easy to look up past foods and insert them or scan barcodes. A note feature would be nice, so that a note that says ""Superbowl"" reminds me why I GAINED weight that day! :-). The free version has upgrade ads, but they aren't TOO annoying. No other ads that I have noticed.",5,2
Rachel Merritt,2025-06-18T22:00:21,"Seriously one of the best calorie tracking apps I've ever used. There's a free version with all the basic features and you can either type in your food item, scan a barcode, or even take a picture to get in the ballpark. Premium features include intermittent fasting, ""high"" days where it recalculates your calories to include treat days, and a bunch of other useful options. I would just add an option to turn off the predetermined amount of calories per meal. I save most of mine for dinner!",5,1
Seeking HisLight,2020-06-15T18:09:11,"I am only a few days in, but so far I really like the app. My favorite feature is that I can scan everything, whether it's a barcode or a plate of food. So far every barcode has been recognized. It doesn't always recognize actual foods, but it's easy enough to do a search for something if it doesn't. I haven't tried all the features yet, but I think I am going to upgrade to premium once I get a wristband that tracks exercise. Once I have used more features I will update my review.",5,90
Jeremy Oser,2024-12-19T17:38:16,"I've lost over 70 lbs so far thanks to the help of this app. If you stick to it and are honest with your logging, you will see real results. The biggest challenge for me is trying to figure out the calories for food that doesn't have them. It would be nice if they could add a feature that calculates the average calories of a specified food/meal. Currently, I search online, and the average the results myself.",5,1
A Google user,2020-01-06T18:13:13,"Fighting weight all my life. More excersize and less calories is the only thing that works in the long run. And counting calories is the most difficult part of it. I've been using this app for several years. It's not difficult, and I find it quite accurate. I lost the weight I wanted and have sustained that by Keeping Up with the calorie counting.",5,0
David B,2024-12-12T00:58:57,"I've been using lose it on and off for years. when I don't use it, I gain weight. when I do use it, I lose weight. Maybe one day I'll unlock the willpower to be able to eat proper portions without meticulously counting calories like an accountant but until that happens I'll be on here logging every gram. The app itself is pretty nice. they have a huge database of pretty much every food and in the rare cases they don't it's easy to add it through the camera. Highly recommend it!",5,16
KP S,2020-05-29T16:58:53,"For a free app, it's a great for tracking your dietary intake. It is user friendly. I like that you have the option of scanning barcodes. You can also, easily, alter dietary information if there is a discrepancy with an item that is already in their system. There are no annoying adds, just a small area at the top that asks you to go premium.",5,40
Jeff,2023-10-07T21:17:35,"20lbs in 6 months! I was eating good food and exercising a lot, but no results. It was the quantity that was the issue!! Without this app, it is extremely difficult to KNOW (not think) how much I am actually eating. $20/year for premium features is not much and I actually bought it after I lost 17lbs! Now I am in maintenance and the premium features makes the app more continent.",5,0
DBA MOM,2020-05-13T18:59:40,Joined Weight Watchers and used their app. It was not user friendly and did not aid in keeping track of my daily intake. Calls to customer service were unsuccessful. This app is everything I've been looking for. It tracks everything for all meals ans snacks. Has a scanning feature that takes out all the research of how many calories in a serving. Highly Recommend.,5,16
Kim A,2022-10-04T17:23:21,Better than My Fitness! Bought yearly membership after logging my second meal! So much easier to log meals. I have an illness that requires 5-7 grams of sodium a day and at least 100 oz of water a day the app tracks it for me. Highly recommend! This app seems to have more food items also. There are many more reasons to get this app. These are just a few of them.,5,0
Adam G.,2022-01-07T18:24:41,"This app has decent UI; I've found it very easy to navigate.  The free version is serviceable if you're on a budget or like to save money, and the database of foods is comprehensive and makes logging meals a breeze.  Knowledge is power: having this app at my fingertips has instilled confidence and motivated me to stay consistent.  So far, I have lost 20 lbs. by simply sticking to a 1,833 calorie diet.  I'm never hungry, and I feel better than I have in years.  Give it a try!",5,92
Chris Bendsen,2024-12-30T19:12:02,"I have never counted calories before but decided to focus on my health in retirement, including my weight. Lose It makes it easy: previous foods eaten are easily available, the bar code scanner makes it easy to add new foods, and many foods I eat out are also in the database. I love how I can subtract calories for exercise and how Lose It can get reports from my exercise app automatically. The periodic emails with dietary information have helped me focus more on what I am eating.",5,1
A Google user,2019-08-30T23:13:47,"Food library is very expansive. Most chain restaurants and brands are in it. Bar code scanning is very nice. Adding my recipes make adding my home cooked meals a breeze. When I actively use it and consciously try to stay under my limits, I feel better and shed weight. It's also nice that it links with Fitbit, Garmin, and Google Fit. Would be nice if it supported Samsung Health.",5,0
Melyssa D,2020-12-11T04:16:06,"I really enjoy this app , Its really easy to use and I love that it has a bar code scanner so I can scan my foods. Its a super fast way to record your calories. However I wish there was some way to record foods for the next day, as I have to prepare my breakfast lunch and snacks the night before for work. It would be so nice if I could record them for the next day this way I don't miss count my calories . Other then that it is a great app!",5,0
A Google user,2019-06-22T02:11:26,"So far, after 3 weeks I've lost 10 lbs! So easy to use. Being able to scan your foods is one of the best features. I'd love to have some kind of ""share"" button to invite/find friends through Facebook more easily instead of using emails though. Still fantastic no matter what. Even if you aren't a Premium subscriber, this app works wonders! Thanks!!! ❤",5,0
Bill Curtis-Davidson,2024-12-17T02:23:15,"I have been using this app now for over 900 days straight. I subscribe to the pro version and set goals for myself that are in line with my fitness journey. It has been an invaluable tool for me, and I have lost over 70 lb in just a few years! I'm also working to build strength and muscle for the long-term. This app has helped me understand my nutrient balance and I'm able to tweak and haul them over periods such as holidays.",5,2
Geric Orias,2023-05-05T20:43:30,"As promised, I was going to change my rating if this app changed my view of it... And sure enough it did! I'm so glad I came across this app! It's much cheaper to subscribe than with MFP, which has ground to a halt for me. Boo! This app pretty much does it all, track cals, fasts, macros, and pretty much any health item you can imagine. I don't really see myself gonna back to MFP at this point ☝️",5,13
Jonathan Bottorff,2024-09-26T15:31:51,"It's pretty much exactly what I wanted out of this app. It's got a great library of foods to look up. You can scan barcodes. It saves everything you've logged, so it's easy to find foods you've had before if you're eating them again. You can create recipes for something like a sandwich or Chipotle bowl, so it's easy to log those in 1 item in the future rather than looking up every ingredient every time. Tracks your macros and you can track your weight. And lots more, but I just ran out of space",5,31
JoAnn Wilkinson,2024-11-19T15:59:04,"I've tried several calorie counting apps, & Lose it is the best. It is the easiest to get your repeated foods, new foods, & to scan labels. I've lost weight with it several times in the last few years & just committed to the lifetime membership because I am committed to feeling this good the rest of my life! It all boils down to calories and making the right healthy choices. It's hard to stay under calories eating bad foods, so it's a learning process, but Lose it makes it easy! Thank you!",5,17
Lindsey B,2023-01-07T16:27:42,"I'm loving this app so far! The database has been great and the user interface feels so much cleaner than other calorie counting apps I've tried. I also love how I'm able to easily change the unit of measurement (ounces, grams) to whatever I need and the program does all the conversions. It makes it so much easier to track and stay motivated. The app also seamlessly syncs my exercise data from Strava and adds my exercise calories. Highly recommend this app! :)",5,8
Kimberly Rodman-Ortiz,2023-06-10T04:14:54,"This app is extremely easy to use. I do not pay for anything to utilize, I have the basic version and it does what I need it to do. It only works if you are consistent and devote to logging everything you eat and the exercises that you do. You use your phone to scan UPC symbols on food packaging to simplify and speed up the logging process. There is also a line graph to show your progress with your weight to help you visualize your journey. There are also challenges you can do within the app",5,1
Meg Kurek,2025-02-20T18:28:58,Love this app! The food database is up to date and accurate. (I compare it to the package info.) The food recording process takes seconds. The fitness tracking features are helpful. The dashboard gives a clear summary of where you are for the day. I use the app when I feel a need for a little extra discipline. It helps me to stay on track and lead a healthy life style. Would recommend highly.,5,2
Allison August,2020-05-21T01:39:23,"It's very easy to use. You set your own goals. Make sure to hit the Done adding button at the bottom for each day. This will allow it to project your results. If you do well you hit your goal sooner. It really makes you pay attention to what & how much you eat. It's simple to add items too. You can search it, scan it or create it. It's quick to enter items you've already used and you can create a recipe that is multiple items for 1 meal.",5,22
Christina Faye Haney,2021-05-25T00:34:52,"unlike most apps which you have an option to get a subscription for It actually allows you to use it. It's really helpful if you want to kind of keep track of your food (food diary) and basic workouts. They have a huge database of foods, they even have foods in there from my local eateries. I personally only needed the basic stuff. But the paid option is really helpful for people who need extra support . It's not overly complicated and it helps you keep track of everything.",5,30
A Google user,2019-08-30T14:26:28,"I love this APP!! It's very helpful in counting calories and so easy to use. It let's me scan the Barcode to input the nutrition label. It also lets me input my own recipes and then does the math as to how many calories are in each serving. I've lost 7 1/2 pounds so far! My whole family is using this app! 9 of us so far! My advise is to stick with it, even if you don't see results at first.",5,6
A Google user,2019-08-24T05:39:46,"Best food tracking app,! Lost over 120 pounds in a year mainly through diet. I like the cute pictures next to the food; my ONLY complaint is when I can't find a picture for the food Im adding. I think I paid like $20 for this app, but I have definitely gotten more use out of it than that. Lots of positive, ""supportive"" people on here; some are a little too positive for me, but I'm a little weird. I wish there was a way to share pictures, but then there might be more creeps and attention seekers.",5,47
Crimson Violet,2023-10-20T09:39:55,"Used (free version) a couple years back, but fell through with it due to personal reasons. This worked amazingly and I never had trouble with it. When they didn't have an item I ate on their list, they allowed me to add it myself with the appropriate nutrition label. Definitely recommend for people who are looking to watch their calorie intake!",5,0
A Google user,2019-08-23T20:54:11,"Awesome app! I have premium which is well worth the tiny fee. Love being able to track macros, exercise, etc. Love the database of foods - scanning a barcode or even adding a new food is super easy. Another favorite feature of mine is being able to create a ""recipe"" so if a meal/salad/snack i eat on a recurring basis always contains the same ingredients, all I have to do is create it once and then voila! I can just select the recipe instead of logging each ingredient every single time I make it",5,23
Lynn,2024-05-26T02:54:04,"I've tried several tracking apps & I like this one a lot. I like the way it gives you options for caloric intake & then splits up your calorie allowance throughout the day. You can also track your fat, protein, & carb macros. So far, every food that I have looked up has been in the system, but it lets you create meals & add foods that are missing. Much less expensive than noom, but doesn't have all the cognitive behavioral therapy components which may be a pro or a con depending on your needs.",5,43
Stacey Van Bogaert,2021-02-14T21:29:06,Love this app - I've used it off and on for years now (start back using it when I've put on a few pounds). Super easy to use - almost any food you can think of is an exact match. Graphs tracking weight loss and calories consumed are helpful. If you wish to count carbs or fat instead of calories you can change this over. Cheaper than the much hyped advertised app - it's really the same thing minus the pep talks and the calorie counter is easier to use.,5,76
Jacob Sims,2020-12-12T07:21:44,"This is the most amazing health app I've ever used. It's really good, and the food logging is the best ever. The food catalog is huge, and who would've thought you could point your camera at food to log it? I didn't, until I downloaded this app. And I'm using the free version, so you don't even have to pay to get most features! 10/10 would recommend 😀",5,3
Patti FLS,2022-10-06T18:03:16,I have previously used Noom and My Fitness Pal and neither was as easy to use as Lose It! I went with premium when given the half price option and I'm glad I did. I love the barcode scanner for entering information! I also like the setup for the meals. I can see which areas I need to focus on with the macro calculator. I'm much more mindful of what I'm eating now. I highly recommend this app!,5,2
John Von Achen,2023-08-30T20:42:51,"This is the best app I have used for tracking calories. I have used My Fitness Pal, Weight Watchers, and numerous others. This app is easy to use. Easy to pull in repeat meals, easy to find restaurant foods, homemade foods, processed foods, easy to share recipes with friends. Connects with many devices and their apps. Love the user interface. Simply great!",5,1
