userName,at,content,score,thumbsUpCount
b b,2025-12-27T20:30:56,"Update: Still a nice app to manually track diet intake. Upped to 4 stars for the recent change made. The app is slow when going/returning to the ""log"". It seems to be related to the ad service they use. There's a 15 second delay before it recognizes any interaction attempts (taps). The list of foods the app provides are usually *incorrect* for the nutritional info. You can create your recipes and foods to track nutrition details. Any bells and whistles are only available in the premium version.",4,5
L P,2025-11-05T02:58:01,"Great app & features, but needs tweaking. Food logging pg is too busy with suggestions. When selecting how much food you ate, there are many items that only give you the option of a serving or grams. I dont always know how much food is in 1 serving, nor am I familiar with grams for food. I'd like to see more options like cups, etc. It also doesn't let you log weight for multiple days at one time if you miss logging - you have to do each day separately. The app is destined for greatness, though!",4,24
Yolanda Sierra,2025-12-05T07:13:50,"This app is easy to navigate and use. Pros: Easy navigation, large data base of different foods including ethnic foods. Cons: The scanner doesn't work even after logging a complaint that was never resolved. Suggestion to the creators: Can we get a search bar on the discover feed section to search for key words that will bring up articles on specific things we would like to read up on to help us on our journeys?",4,13
Laura C.,2025-11-23T16:55:08,"There needs to be an option to turn off automatically setting all future day foods as ""planned."" It's truly annoying to plan your meals ahead, then have to open every individual food on the log and change that setting. This is a big annoyance for those of us who are good at planning. Otherwise, app is very good",4,15
Jay B.,2025-12-27T06:56:02,"Please return the arrow back to the calendar! they just removed the arrow to go back to yesterday. why??? why remove the arrow???now I have to open a calendar, which takes like ten seconds, then find yesterday select and enter. it used to have an arrow. forgot to enter some last thing from yesterday? work an unusual schedule? Too bad, you have to jump hoops thanks to this innovative update that makes it more inconvenient. while that happens you may have to deal with disruptive ads.",4,2
James Larson,2025-12-31T23:44:48,"Upgrading to premium is broken. there seems to only be one way to do this - through the app. Which would be fine if there was a way to edit creds instead of the app locking in a default to use the google account associated with my phone. Otherwise giving Lose It my money is an exercise in aggrevation. Also, as many others have noted, I liked Lose It vs other apps like MyFitnessPal becsuse it DIDN'T have all the extra unecessary garbage. Lately they seem to be going in the wrong direction.",4,12
Lisa Lu,2025-04-10T20:33:28,"I have been using this app for 9 years on & off, and I love that it retains all that data. The app has evolved over the years to include tracking of nutrition, specific diet plan and eating plans, ability to create your own recipes, and scanning bar codes for easy logging, in addition to weight tracking, water intake and excercise. I have found it worth it to me to subscribe to premium. my only issue right now is I can't update my profile. can I get some help? getting error.",4,3
A Kow,2025-01-07T03:45:00,"Wonderful app for tracking your diet and exercise and it's mostly free! You can upgrade for a fee, but can really get the gist of what it can offer for free. One problem is that some of the foods pre installed or added by participants have incorrect nutritional information. You have the option to add foods and edit them, but sometimes it doesn't save accurately. Be aware.",4,2
A Google user,2019-07-05T17:06:38,"Lose it has really helped me. I have lost over 10 lbs. I would love to have the premium subscription, but I can't afford all of it at once. If they broke it up into 2 payments, I would do that. Adding a new recipe is confusing and I if I mess up, I have to start all over, I can't delete an ingredient after I save it. Also the weight loss configuration does not account for body frame.",4,1
Belle Losiraptor,2024-12-13T20:44:29,"I used this in the past and he tried others and I always end up going back to this app. I especially like the feature where it gives the grams of protein, carbs, and fats for the day. I hope they continue to grow their food database and hopefully there's an easier way to log food if you primarily cook at home (from recipes). But overall my favorite app to use for tracking food.",4,4
Ahllora Lee,2024-07-25T23:11:14,"The only thing that could make this better for me is to make it to where both of my devices with the same account are updated to match each other. When at work or out, I use my phone, when at home, I use my reading tablet. Sucks that if there is some issue it doesn't update between devices unless I uninstall and reinstall it. Doesn't happen too often, but often enough to be an annoyance. If there was a way to just sign out and sign back that'd be awesome, but there isn't...",4,1
t 778,2021-01-23T19:06:15,"This app is very user friendly. It's helped me keep better track of what I'm eating and when I exercise. I've lost 25 lbs in 2 months. I wish the premium version offered a discounted trial, or billed monthly. So far I'm still on the free version. Update: after I hit the 25 lb mark, and especially after the 50 lb mark, there were no more badges to earn. It's been very disappointing. That was a big part of the motivation and fun.",4,0
C. Bartlett,2022-10-06T19:34:43,"Update: Trying to unsubscribe from the yearly fee crashes the app. (Did it via desktop website) I did the yearly program which unlocks a lot of insightful things. I like that it tracks progress, goals, and shows you calorie counts, but I am not a fitness person so I may be missing features or where it could be improved. I'm just taking the app at face value & following its suggestions. One thing that's cool is that you can just scan UPC codes of the food container and add it to your meal.",4,77
Jessica,2024-05-15T06:31:56,"I like how when I search for an item in My Foods that it's ordered by most recent. Search function is also a lot more functional. On the other hand, with my iPhone I could hit the edit button and easily move items around when logging my meals, along with swiping to delete an item. Where's the option on Android? There also seems to be a bug: If I accidentally select or add an item and then unselect it, it will still say that I've had that item recently, and now I can't see the real last date.",4,0
Audrey,2025-08-08T15:02:59,"I've been using this app for a week now, and I'm actually seeing results with very little to no exercise. The app can get a bit glitchy, but it is easy to use and has a huge library of foods that you only have to scan the barcode on the product to enter. It honestly feels like a game to me where my calorie budget is my in-game currency that I'm using to ""purchase"" my meals. I'm loving this app!",4,6
A Google user,2020-01-09T14:09:27,"I haven't been using this app for very long - so I'll try to update once I continue. However, the app is very easy to use and has a smooth interface. Even without the premium version, you can see your predicted goals, and the percentages of carbs, fats, and proteins in your food. In setup, it will ask if you want to look better vs feel better, or what's more important to you in your food. The only reason I gave four stars and not five is because I havent been on the app for long. 💖💫😊",4,2
Vik Marcussen,2024-08-03T23:42:48,"Best app I've found for calorie tracking. It makes it easy enough to do that I don't have trouble coming back to it. My biggest gripe: while it says you can set your own goals - maintaining weight, building muscle - it's still 100% focused on weight loss. I'm underweight and my goal is to be above a certain weight and cal count, but it tells me I've reached my goal when I record my weight because it's under my goal. When I'm over my calorie minimum, it turns red; when under, it congratulates me.",4,11
emily collins,2023-09-10T18:05:17,"I like the app, it does exactly what I needed which was log my food and track calories. I gave it a 4 because the premium portion you can pay for is not worth the amount they charge. I tried the free with the ads and the premium and I didn't utilize the extra micronutrients tracking because I didn't need all that but someone else might.",4,5
Jennifer Johnson,2024-10-21T23:48:53,"This app works extremely well for keeping on track with my weight loss goal. It's easy to use and has a robust catalog of foods in the search tool. My one ""complaint"" is regarding the feature of having extea calories budgeted to certain days of the week. I feel that the extra calories would be more useful if they had a separate tracker. For example, if I want to alot myself 700 floating calories to use on any given week I could apply those to the ""extra bucket"" on any given day that works best.",4,6
Salamander,2023-02-23T01:14:58,"After scanning an item, it may be incorrect. I scanned beef, seaweed snacks, keto flour, and other food items, and the calorie counts were all incorrect. The keto flour says 1/4 of a cup is 80 calories on the bag, yet the app tells me it's 110 for the same amount. The beef I bought says it's 190 calories for four ounces, but the app says three ounces. Net carb calculator works and it's a good way to count calories. Better than MyFitnessPal. But needs some adjustments.",4,3
A Google user,2019-02-01T17:50:06,"It's a helpful everyday tool for calorie tracking. I like that you can personalize your calorie goal and track proteins, carbs, and fat. It could also potentially be helpful for maintaining or gaining healthy weight. ⭐One thing I wish they would fix though is sometimes I will see two listings of the same exact food or drink that have different calorie/nutrition info, but are both verified for correctness. This is conflicting info and makes the source less trustworthy!",4,15
A Google user,2019-08-26T09:12:59,"Easy to add, although a bowl of cereal, for example, can take a while, since each ingredient is a separate line. Excercise calories burned may or may not be legit, but judge for yourself and i just adjust as needed. There are a few things that you can do online but not in the app, so check out all the settings on both.",4,1
A Google user,2018-11-06T15:40:56,"Pretty sweet app. Very similar to MyFitnessPal but without the extreme data usage. Food list has very few erroneous entries as compared to competitors. Integrates with Google Fit and Strava. Few suggestions for improvement: - Need the ability to log water ounces by user-specified number instead of 8 ounce increments - Add ability for a family or group of friends to create a private group and share their progress with each other. The best way to stay fit and healthy is with accountability from a friend (not a random stranger online). - Consider keeping the discount price at $30 ($40 is too much) or even dropping it to $20 per year. If you add the private group option above, it will definitely be an incentive for people to pay for the app.",4,5
A Google user,2018-09-22T17:05:12,Consistency is key. The app has cute little reminders to keep you on track. Honestly writing down what I'm eating on a daily basis has been the key of my weight loss. sometimes just knowing that you will have to add something to your tracker will keep you from eating something that is not healthy for you. I got the premium version for the ability to track in advance because if I am planning on eating a certain thing I can budget for that. I've been eating the calories recommended and have not been hungry. it's up to you and how dedicated you are to your own health but this is a very helpful tool.,4,4
David Bankson,2022-02-08T08:12:11,"I am finding it useful, except it doesn't send calories correctly when connected to Google Fit...It only sends the calories of the first food item of the day, and stops until the following day, instead of sending the total when you are done with the day. **edit: calories are sending after every item now, but if you make changes to (or remove) an item, it can't update Fit correctly.",4,0
Amy S.,2024-11-19T15:30:11,"I really like this app, the only thing that would make it better is if we could ""favorite"" foods to come back later to log them instead of having to search them every single time. Being able to scan the label is nice if they have them, but when we have leftovers, it sucks having to search the meal to log it every single time or even keep the barcode to scan it just to log the leftover until they are all eaten. I pay for premium, so this would be an awesome addition to premium membership.",4,2
Jessica Anderson,2021-10-23T06:38:02,"I like this app. Do I love it? No. But it's adequate for starting out on my health journey for now. I use the free version, which allows me to track my exercise, weight, what I eat (calorie count) and also see my daily food intake divided into fat, protein, and carbs. The ""upgrade to unlock"" parts are a little in your face, as well as the frequent ""sales"" for premium, etc. It would be nice to not have the premium features on your dashboard. But overall it's doing what I need.",4,14
Scott Steinberg,2023-02-06T17:31:26,"I have been using this app for a little over a week now and I love it. I upgraded to premium 3 days in and am glad I did. It is very easy to track calories, macronutrients and sodium, as well as my weight and blood pressure. Extensive food bank with many national restaurants and store brands, the ability to scan bar codes and manually enter nutrition info to create foods and recipes. It loses one star b/c the ""scan your food"" function needs work...it identified pork tenderloin as French toast!",4,0
A Google user,2019-03-24T21:39:34,"I love this app! I would have given it 5 stars because it does really meet all my needs except: 1. It doesn't allow to move a food item into a different meal rather than having to delete it, then add it to the correct meal. 2. It would be helpful to edit personally created recipes. For example: any recipes that I created have to be recreated if I need to edit ingredients. Honestly, these are features I'd like to see added in new editions of the app. Hopefully they read customer comments! ;-)",4,11
A Google user,2019-03-19T16:05:33,"i like that it has a large database of foods. and to use the basic functions you dont have to pay. I do wish some of the foods had more options of measurements. i mostly use cups and tablespoons so ounces and grams dont really help me. Also, there needs to be a way to edit or delete recipes. After seeing the calories on some of the things i eat ive been trying to modify but i have to make a whole new recipe rather than edit one i already have.",4,5
A Google user,2019-03-10T18:40:29,"I've been using the app consistently for a month and I've lost 13lbs (and still going). Counting calories is the only consistent form of ""dieting"" that has worked for me so far. I'm not even exercising! The scanning of the barcodes is a little annoying and measuring everything out, but it's definitely worth it. Definitely worth a try on the app.",4,17
A Google user,2019-05-22T05:49:50,"Writing down my meals daily has been very motivating. I like Lose it because it is easy to search for the nutritional value of most of my meals, however the nutrition value of many food items are not complete or have not been verified by Lose it. So I find myself checking for myself. Also more instructions are needed for recording your meals. You eventually figure it out, but you end up using the Save feature erroneously at first. Still, it is a very good app for weight loss goals.",4,0
A Google user,2020-02-11T04:21:49,"Nice calorie tracking app with a bunch of prefilled foods. The ability to add your own recipes is very nice. There is no way to manually lower your max daily calories, its figured out by how much you want to lose, with the max being 2lbs a week, but even if you know you need less calories you cannot change it. The water intake tracker doesn't pull from the food logger. For example if I add a cup of tea for lunch, I have to add 8oz to the water tracker.",4,17
A Google user,2019-12-15T05:34:11,"I have the base app and it works perfectly for helping me track my calories and stay on track. I'm down 12 pounds in three weeks while allowing myself a weekly cheat day. I love the bar code scanning feature and the ability to lookup food from popular restaurants. I have one gripe... I added an exercise (weightlifting) from the list of exercises and now when try to add another exercise my only option is is weightlifting, I can't get back to the full list (no option to remove filter).",4,118
Bryan Culver,2022-10-16T14:17:12,"Came back to this app after a hiatus to have a baby. Now I can't access any of the analysis on my DNA, and my reports are no longer getting emailed to me. I'm pretty disappointed with my year subscription, and I won't make that mistake again. - edit: Their help desk was very responsive and was able to correct the problem I identified. I hope they keep making strides to improve and maintain the service!",4,1
A Google user,2019-04-02T05:01:35,This really does help me stay accountable. Very easy to use. Saves meals for easy reuse (rather than entering each item all over again). The bar code scanner works great. They have most restaurants/brand name foods. Lets you track macros. My only wish is that I could meal plan my days for a week at a time without paying for premium as the other features arent that exciting for me. Otherwise love it.,4,78
A Google user,2018-10-28T17:08:50,"Love this app!! I have tried other apps, but this is the best I've tried. Very easy to use. Love that I can just log quick calories if I don't want to enter a new food. The database for restaurant foods seems to be pretty accurate. I would have rated it a 5 a couple of weeks ago, but they took away one of my favorites features, which was the quantity ""spin"" feature. Now you have to enter fractions on your own. So now if I eat 3/8ths of something, I have to figure out for myself what that is to enter. Sounds like a silly complaint, but fractions have never been my strength. Other than this one little thing, it's the best app around!!!",4,12
A Google user,2019-05-19T17:26:18,"So far I've lost over 100 lbs. I'm on a CC diet (""counting calories""). Couldn't have done it without Lose It. I only have one objection and one suggestion! Objection: I'm an android user (as I'm sure many users are) and I can't transfer a posted meals to a different date. That means I end up posting it twice then deleting the post on the date I don't want. It's time consuming. Suggestion: I want to be able to access my notes with a search option so I can refer to them.",4,7
A Google user,2019-07-23T19:00:29,"Personally, this works great for me because of what habits I needed to chnage to lose weight. if you're like me, you often binge without looking to see what's in the food, and them try to cut portions but only estimate. With this app, I was able to see what's in my food, how much I should eat for my desired weight loss, and it worked out great, currently have lost 4 pounds. However, for someone looking into tracking every variable of their health, this is not the fitness app for you.",4,2
A Google user,2019-02-10T17:18:39,"helpful app to help you keep track of all your calories during the day. it has been very helpful so far, ive already lost 2 pounds. I did just have a small bug in the app though, i tried to add a meal on sunday morning, but any time i would add it, it would add it to the day before. so now its showing my saturday calories as if i ate too much and i cant fix it, nor will it add the meal to todays counter. im going to try to uninstall it and reinstall it to see if it fixes it.",4,0
Kim Mabes,2025-04-23T12:59:28,"I like this app, but it is my second choice if I could only choose one. I use 2 and this app has a more extensive library. Custom recipes are easy to create. Navigation isn't hard but could be more convenient. I have a yearly subscription but I do wish they had recipes to recommend for the diet you decide to choose to better direct a user. Plus, any additional information is an additional cost which I feel, should be included to help someone on their journey.",4,138
Alex R,2025-09-12T08:19:01,"As a premium user, this app has been great for logging, tracking and storing my homemade recipes over the past nearly 10 years. I do think it lacks some features. I wish it would give me the option to have my calories adjust based on over or under eating in days prior, and sometimes the display is hard to navigate on the goals tab, but aside from that it does just what I need it to do.",4,21
Limar,2025-02-13T06:16:22,"Love the app, have used it for years. It's the nicest user interface among the calorie trackers out there. My only wish is that it had a tracking plan for gaining weight as well (I know, blasphemy to the name of the app). When trying to put on weight, everything turns red and looks like it's shaming you. Would love the option to set different calorie goals above maintenance.",4,0
A Google user,2019-06-06T02:40:09,"Tracking caloric intake is easy with the free app. Accepted my goal weight and told me how many calories a day to lose the weight in two years. Then it has an extensive list of foods, some by brand, with calories. Have to be careful bcz you/I can add foods and some of the calories are way off. Then it remembers my foods, and it remembers my meals, so i can pick them off a list instead of recreating everytime. And I can put in exercise and it subtracts calories.",4,0
Kyle Bear,2022-09-14T17:46:43,"It's pretty solid. I enjoyed it as a free user. Because it didn't feel like I was being abused, unlike MyFitnessPal, and the price was fair I decided to go premium. I'd still strongly recommend the all for those that are looking for calorie tracking on a budget. That said they could make the app even better if they would add a bit of case based reasoning when I'm adding foods to my diary. I'd like the app to be smart enough to know that I prefer a certain type of measurement for certain foods.",4,29
A Google user,2019-04-16T04:11:59,"I have used this app on and off for a few years now and have lately purchased the yearly membership in order to get motivated to really start paying closer attention to what I consume. However, I do have one request. I wish there was a section of the app entirely for scanning labels. Instead of waiting to scan a label when I go to eat, it would be nice to go to a ""Scanned Foods"" section when I get home from the grocery store, this way it is easier to quickly log meals.",4,3
CC dK D,2023-05-04T09:51:39,"I've been a premium member for a few years. I bought the Black Friday special online for $15/year. I appreciate that this app has great features for a reasonable premium price, unlike others I could name. The developers seem to listen to member feedback and are always making improvements. We finally got an option to select different calories for different days of the week. And they removed the 800 calorie minimum. Now I can finally set up my 4:3 calorie budget!! I'm so happy!!!",4,0
J E,2025-08-02T20:47:06,"I like this app. It's very easy to use and it has a wide database of foods available for either scanning a barcode or searching by name. I find the calorie count accurate, however for the macros tracker section it seems to be off calculation sometimes. Overall it's a decent app and is available for free if you stick with the basic version.",4,2
A Google user,2019-05-25T02:09:14,"This app is super helpful for tracking my calorie intake. It's made me more aware of my portion sizes and snacking off my kid's plates. One odd blip: last weekend I hiked for 7 1/2 hours up and down a mountain. My calories for the day ended up being negative 2,200+. The app doesn't know how to show that day's info. It just skips that day, saying I haven't done 7 straight days. Weird, but I still really like the app.",4,0
Spurlock,2020-07-02T01:11:18,"This app is pretty good, especially if you get the premium version. However, there is some things that need to be fixed: 1) I'm having trouble loading the group I'm in and the app even crashed at one point. 2) I want to be able to add/see the type of fat being tracked, not just fat and saturated fat. 3) I'd like to see the vitamins able to be listed for each food. The biggest problem I'm having though, is loading the posts on my group's page. Sometimes it'll even say that I'm not in it but I am.",4,9
Cliff Heick (That C-Note Guy!),2025-08-07T17:45:50,"This app is awesome, and it's really helped me shed some pounds without too much trouble. If you struggle with dieting, tracking your calories makes it way simpler. I just wish the food database was a bit better, and it'd be cool if the dashboard showed your weight/fat% instead of just ""recorded"" when you log it.",4,1
A Google user,2019-02-25T20:32:52,"Great easy to use app. Strong db of foods to choose from. Barcode feature works great on pricessed foods, plenty of options for building your own recipes and the app analyzes them for calories, protein, etc. i wish there was better analysis tools, though; would love to see what percentage of calories are coming from animal products, for example.",4,1
